RazaoSocial;UF;TotalDespesas;MediaPorTrimestre;DesvioPadrao;QuantidadeTrimestres
UNIMED PARÁ DE MINAS COOPERATIVA DE TRABALHO MÉDICO LTDA.;MG;133749783.71;44583261.24;23391644.95;3
UNIMED SÃO JOÃO DEL REI - COOPERATIVA DE TRABALHO MÉDICO;MG;133503956.58;44501318.86;23834208.52;3
METLIFE PLANOS ODONTOLÓGICOS LTDA.;SP;132604781.91;44201593.97;22424673.70;3
GARANTIA DE SAÚDE LTDA;SP;132253115.94;44084371.98;22097915.49;3
NOVA SAÚDE OPERADORA INTEGRADA DE SAÚDE LTDA;RJ;131816169.01;43938723.00;22949038.25;3
UNIMED JOÃO MONLEVADE COOPERATIVA DE TRABALHO MÉDICO LTDA.;MG;130663071.93;43554357.31;23812721.27;3
UNIMED OS BANDEIRANTES COOPERATIVA DE TRABALHO MÉDICO;SP;128144955.44;42714985.15;19137563.54;3
UNIMED SAÚDE E ODONTO S.A;SP;127843897.04;42614632.35;24004438.21;3
UNIMED ERECHIM - COOPERATIVA DE SERVIÇOS DE SAÚDE LTDA.;RS;127502935.17;42500978.39;21196262.43;3
UNIODONTO DE CAMPINAS COOPERATIVA ODONTOLÓGICA;SP;127133840.98;42377946.99;22713129.29;3
UNIMED FRONTEIRA NOROESTE/RS - COOPERATIVA DE ASSISTÊNCIA À SAÚDE LTDA.;RS;126246871.21;42082290.40;22603693.30;3
UNIMED CENTRO SUL FLUMINENSE COOPERATIVA DE TRABALHO MÉDICO;RJ;126162844.58;42054281.53;23741137.38;3
GOCARE PLANOS DE SAUDE LTDA;SP;125695517.48;41898505.83;17567761.12;3
IRMANDADE DA SANTA CASA DE MISERICORDIA DE LIMEIRA;SP;125375353.84;41791784.61;22180135.62;3
UNIMED DE CAÇAPAVA - COOPERATIVA DE TRABALHO MEDICO;SP;123745396.45;41248465.48;22003850.12;3
OESTE SAÚDE ASSISTÊNCIA A SAÚDE SUPLEMENTAR S.A;SP;123207680.60;41069226.87;22983359.96;3
UNIMED VALE DO AÇO COOPERATIVA DE TRABALHO MÉDICO;MG;123046283.01;61523141.51;32406671.70;2
UNIMED ITABIRA COOPERATIVA DE TRABALHO MÉDICO;MG;122919756.21;40973252.07;22331271.04;3
CAIXA DE ASSISTÊNCIA DOS EMPREGADOS DO SISTEMA FINANCEIRO BANESTES;ES;122666473.39;40888824.46;20170370.57;3
UNIMED ALTO VALE - COOPERATIVA DE TRABALHO MÉDICO;SC;120665406.39;40221802.13;21190598.14;3
UNIMED DE LENÇOIS PAULISTA - COOPERATIVA DE TRABALHO MÉDICO;SP;120215116.18;40071705.39;20199500.22;3
UNIMED ARAXÁ COOPERATIVA DE TRABALHO MÉDICO LTDA.;MG;120164273.22;40054757.74;21358209.26;3
UNIMED ARAGUARI COOPERATIVA DE TRABALHO MÉDICO;MG;120017534.83;40005844.94;20878366.08;3
VIVACOM PLANOS DE SAÚDE;GO;119386697.32;39795565.77;20723598.47;3
UNIMED DE CATALÃO COOPERATIVA DE TRABALHO MÉDICO;GO;117921845.32;39307281.77;20417977.50;3
UNIMED DE LINS - COOPERATIVA DE TRABALHOS MÉDICOS;SP;117606848.65;39202282.88;18826745.64;3
UNIMED BARBACENA - COOPERATIVA DE TRABALHO MÉDICO LTDA;MG;117391545.01;39130515.00;22344291.18;3
ASSOCIAÇÃO DE ASSISTÊNCIA À SAÚDE DA AMAGIS;MG;116906421.07;38968807.02;21263188.64;3
UNIMED CENTRO PAULISTA - FEDERAÇÃO INTRAFEDERATIVA DAS COOPERATIVAS MÉDICAS;SP;113967236.26;37989078.75;19632553.53;3
PLAMED PLANO DE ASSISTENCIA MEDICA LTDA;SE;113782654.12;37927551.37;20364674.54;3
ASSOCIAÇÃO DE SAÚDE DOS FORNECEDORES DE CANA DE PIRACICABA E REGIÃO;SP;112454503.39;37484834.46;20416157.51;3
AMEPLAN ASSISTÊNCIA MÉDICA PLANEJADA LTDA;SP;112422448.87;37474149.62;17278835.39;3
SULMED - ASSISTÊNCIA MÉDICA LTDA;RS;111230671.76;37076890.59;20115872.13;3
ESMALE ASSISTENCIA INTERNACIONAL DE SAUDE LTDA.;AL;110856960.73;36952320.24;18658674.00;3
UNIMED EXTREMO OESTE CATARINENSE COOPERATIVA DE TRABALHO MÉDICO;SC;109334515.01;36444838.34;18502305.67;3
PARANA ASSISTENCIA MEDICA LTDA;PR;109267670.24;36422556.75;19948586.97;3
FUNDACAO LEONOR DE BARROS CAMARGO;SP;108985730.80;36328576.93;19914617.30;3
CAIXA ASSISTENCIAL UNIVERSITÁRIA DO RIO GRANDE DO NORTE;RN;108947009.16;36315669.72;18678765.18;3
ASSOCIAÇÃO PETROBRAS DE SAÚDE - APS;RJ;107218871.94;35739623.98;6557168.35;3
UNIMED NOROESTE DO PARANÁ COOP DE TRABALHO MÉDICO .;PR;106889068.25;35629689.42;20565367.89;3
MATÃO CLINICAS & AMHMA SAÚDE LTDA;SP;106496175.90;35498725.30;17802932.61;3
UNIMED DE IBITINGA COOPERATIVA DE TRABALHO MÉDICO;SP;106418946.51;35472982.17;17780880.38;3
UNIMED ALTA MOGIANA COOPERATIVA DE TRABALHO MÉDICO;SP;106102763.34;35367587.78;19103391.36;3
UNIMED MURIAÉ COOPERATIVA DE TRABALHO MEDICO LTDA;MG;105752643.41;35250881.14;17621424.07;3
UNIMED DE GUARATINGUETA-COOPERATIVA DE TRABALHO MÉDICO;SP;105498786.47;35166262.16;18690010.25;3
TEMPO MED PLANO DE SAUDE LTDA;SC;105030125.31;35010041.77;21975288.04;3
UNIMED NORTE PIONEIRO - COOPERATIVA DE TRABALHO MÉDICO;PR;104747411.56;34915803.85;19119460.12;3
ASSOCIAÇÃO MINEIRA DE ASSISTÊNCIA À SAÚDE DOS MEMBROS DO MINISTÉRIO PÚBLICO;MG;104700196.46;34900065.49;18853609.97;3
BEST SENIOR OPERADORA DE SAÚDE LTDA;ES;104629654.13;34876551.38;22336158.70;3
UNIMED DE SOBRAL SOCIEDADE COOPERATIVA MÉDICA LTDA;CE;103332531.79;34444177.26;18495666.76;3
UNIMED CABO FRIO COOPERATIVA TRABALHO MÉDICO LTDA.;RJ;102442705.88;34147568.63;18871274.93;3
HOSPITAIS E CLÍNICAS DO PIAUÍ S/S LTDA;PI;102401803.71;34133934.57;18065403.08;3
ASSOCIAÇÃO POLICIAL DE ASSISTÊNCIA À SAÚDE;SP;102305447.27;11367271.92;10497455.90;9
ASSOCIAÇÃO DE ASSISTÊNCIA MÉDICO HOSPITALAR DOS MAGISTRADOS DO ESTADO DO PARANÁ;PR;102229425.85;34076475.28;19711853.27;3
UNIMED SUL PAULISTA - COOPERATIVA DE TRABALHO MÉDICO;SP;102217995.45;34072665.15;17479871.29;3
UNIMED TRÊS RIOS COOPERATIVA DE TRABALHO MÉDICO;RJ;102144091.75;34048030.58;17072757.55;3
CAIXA DE ASSISTÊNCIA À SAUDE DOS EMPREGADOS DA CODEVASF - CASEC;DF;101954956.90;33984985.63;14602953.35;3
UNIMED LAVRAS COOPERATIVA DE TRABALHO MÉDICO;MG;100477134.36;33492378.12;17833358.84;3
UNIMED CAÇADOR COOPERATIVA DE TRABALHO MÉDICO DA REGIÃO DO CONTESTADO;SC;99483453.45;33161151.15;17708804.16;3
AMHA SAUDE S/A;SP;99309018.54;33103006.18;16634151.52;3
SUL AMÉRICA ODONTOLÓGICO S/A;SP;98848719.70;32949573.23;16678401.46;3
AMHE MED ASSISTENCIA A SAUDE LTDA - EPP;SP;98645767.39;32881922.46;25992624.73;3
SANTA CASA DE MISERICORDIA DE SAO JOAQUIM DA BARRA;SP;98229934.58;32743311.53;17678347.79;3
UNIMED VALE DAS ANTAS, RS - COOPERATIVA DE ASSISTÊNCIA À SAÚDE LTDA.;RS;98128852.20;32709617.40;13195840.89;3
UNIMED MEIO OESTE CATARINENSE COOPERATIVA DE TRABALHO MÉDICO;SC;98065819.70;32688606.57;16138276.24;3
SISTEMAS E PLANOS DE SAÚDE LTDA.;SP;97829993.22;32609997.74;16518040.08;3
INSTITUIÇÃO BENEFICENTE CEL MASSOT - IBCM;RS;97421282.10;32473760.70;19434951.57;3
ASSOCIAÇÃO DO PLANO DE SAÚDE DA SANTA CASA DE MISERICÓRDIA DE ITABUNA - PLANSUL;BA;96428559.75;32142853.25;16115874.74;3
UNIMED COSTA VERDE RJ;RJ;95284691.20;31761563.73;15223236.00;3
ASSOCIAÇÃO DE SAÚDE DO VALE;SC;94716136.26;31572045.42;17718253.02;3
CAIXA DE ASSISTÊNCIA À SAÚDE DO SINDICATO DOS FUNCIONÁRIOS INTEGRANTES DO GRUPO OCUPACIONAL ADMINISTRAÇÃO TRIBUTÁRIA DO ESTADO DE PERNAMBUCO;PE;94716086.22;31572028.74;17337494.58;3
UNIMED NOROESTE FLUMINENSE - COOPERATIVA DE TRABALHO MÉDICO LTDA;RJ;94388331.58;31462777.19;16149796.12;3
UNIMED SÃO LOURENÇO COOPERATIVA DE TRABALHO MÉDICO;MG;93939103.67;31313034.56;15479711.91;3
SAMOC S.A. - SOCIEDADE ASSISTENCIAL MÉDICA E ODONTO CIRÚRGICA;RJ;92907481.17;30969160.39;16002046.43;3
ASSOCIAÇÃO MAIS SAÚDE SANTA CASA DE SÃO JOÃO DA BOA VISTA;SP;92453998.43;30817999.48;18081251.59;3
UNIMED NORTE PAULISTA - COOPERATIVA DE TRABALHO MÉDICO;SP;92021923.75;30673974.58;15359121.45;3
FUNDAÇÃO LIBERTAS DE SEGURIDADE SOCIAL;MG;91951231.91;30650410.64;15571998.40;3
SÃO FRANCISCO ASSISTÊNCIA MÉDICA LTDA;PE;91717788.82;30572596.27;16114296.61;3
ASSOCIAÇÃO SÃO LUIZ SAÚDE;SP;90961872.43;30320624.14;14398749.07;3
DENTAL UNI - COOPERATIVA ODONTOLÓGICA;PR;87713379.45;29237793.15;15357008.94;3
UNIMED ITUIUTABA COOPERATIVA TRABALHO MÉDICO LTDA.;MG;87554988.86;29184996.29;14970768.05;3
PRONTOMED PLANOS DE SAÚDE LTDA;MG;87551007.61;29183669.20;15666449.90;3
IRMANDADE DE MISERICÓRDIA DO HOSPITAL DA SANTA CASA DE MONTE ALTO;SP;87206019.11;29068673.04;15287573.07;3
UNIMED ITAÚNA COOPERATIVA DE TRABALHO MÉDICO LTDA.;MG;86998586.41;28999528.80;14455308.57;3
ELETROS SAÚDE - ASSOCIAÇÃO DE ASSISTÊNCIA À SAÚDE;RJ;85860669.92;28620223.31;16879237.34;3
PLANO DE SAUDE ASES LTDA.;RJ;85759484.04;28586494.68;14636200.34;3
COOPERATIVA DE TRABALHO MÉDICO DO PLANALTO NORTE DE SANTA CATARINA LTDA;SC;85630265.58;28543421.86;14348338.65;3
AMAZÔNIA PLANOS DE SAÚDE LTDA;PA;85629234.85;28543078.28;15311424.87;3
PLADISA PLANOS DE SAÚDE SA;SC;84984001.92;28328000.64;14783945.66;3
UNIMED GUAXUPÉ COOPERATIVA DE TRABALHO MEDICO;MG;84880229.89;28293409.96;14998121.65;3
CAIXA DE ASSISTÊNCIA DOS FUNCIONÁRIOS DO BANCO DA AMAZÔNIA - CASF;PA;84495460.48;28165153.49;11870303.58;3
UNIMED MARQUES DE VALENÇA COOPERATIVA DE TRABALHO MÉDICO LTDA.;RJ;84464055.56;28154685.19;15868049.70;3
UNIMED DE BIRIGUI - COOPERATIVA DE TRABALHO MÉDICO;SP;84233327.78;28077775.93;14085383.52;3
SÃO DOMINGOS SAÚDE- ASSISTÊNCIA MÉDICA  LTDA;SP;83073238.32;27691079.44;14996473.89;3
UNIMED ALTO DA SERRA - SOCIEDADE COOPERATIVA DE SERVIÇO MÉDICO LTDA.;RS;82686554.04;27562184.68;14787479.34;3
LEADER ASSISTÊNCIA MÉDICA E HOSPITALAR LTDA.;SP;81527646.44;27175882.15;12312662.78;3
IRMANDADE DA SANTA CASA DE MISERICÓRDIA DE PASSOS;MG;79026822.81;26342274.27;13735759.54;3
UNIMED VALE DO JAURU COOPERATIVA DE TRABALHO MÉDICO;MT;79021420.70;26340473.57;12835140.23;3
ANAFE SAUDE;GO;78977396.93;26325798.98;13088492.29;3
ASSOCIAÇÃO POLICIAL DE ASSISTÊNCIA À SAÚDE DE BAURU;SP;78907084.91;26302361.64;13687094.38;3
ÚNICA ASSISTENCIA MEDICA LTDA;SP;78806145.02;26268715.01;13669164.07;3
VITA ASSISTÊNCIA A SAÚDE LTDA.;MG;78348700.93;26116233.64;20737275.79;3
UNIMED DE BARRETOS COOPERATIVA DE TRABALHO MÉDICO;SP;77492133.89;25830711.30;14208551.68;3
UNIMED PATROCÍNIO COOPERATIVA DE TRABALHO MÉDICO LTDA.;MG;76841890.05;25613963.35;13911699.52;3
UNIMED DE AVARÉ COOPERATIVA DE TRABALHO MÉDICO;SP;76774806.39;25591602.13;13551298.09;3
MAIS SAÚDE PLANO DE SAÚDE LTDA;GO;76217591.93;25405863.98;14236071.71;3
UNITY SERVIÇOS INTEGRADOS DE SAÚDE LTDA.;DF;75011392.14;25003797.38;14939302.14;3
UNIMED DE CIANORTE - COOPERATIVA DE TRABALHO MEDICO;PR;74895743.49;24965247.83;13590726.52;3
UNIMED DE CAPIVARI -COOPERATIVA DE TRABALHO MÉDICO;SP;74406990.50;24802330.17;12870468.30;3
CAIXA DE ASSISTÊNCIA SISTEMA SAÚDE INTEGRAL-SSI SAUDE;RS;74177108.39;24725702.80;14299425.11;3
GS PLANO GLOBAL DE SAÚDE LTDA;RJ;73831874.42;24610624.81;13387170.44;3
SAÚDE BRASIL ASSISTÊNCIA MÉDICA LTDA.;SP;73641409.04;24547136.35;14916541.95;3
IRMANDADE DE MISERICORDIA DE PORTO FERREIRA;SP;73580516.45;24526838.82;13732525.10;3
CAIXA DE ASSISTÊNCIA AOS MEMBROS DA DEFENSORIA PÚBLICA DO ESTADO DO RIO DE JANEIRO;RJ;72109876.38;24036625.46;13490571.39;3
ASSOCIAÇÃO SAÚDE SÃO JOSÉ;SC;71958987.79;23986329.26;13240630.64;3
UNIMED ALTO SÃO FRANCISCO COOPERATIVA DE TRABALHO MÉDICO;MG;71588769.72;23862923.24;12803015.18;3
ASSOCIAÇÃO DOS AUDITORES FISCAIS DO ESTADO DA PARAÍBA - AFRAFEP;PB;71175235.41;23725078.47;12253463.11;3
UNIMED DE TAUBATÉ COOPERATIVA DE TRABALHO MÉDICO;SP;70890921.92;23630307.31;12245237.22;3
COOPERATIVA DE TRABALHO MEDICO DE ARAGUAÍNA - UNIMED ARAGUAÍNA;TO;70435815.93;23478605.31;12283400.34;3
UNIMED DE TUPA COOPERATIVA DE TRABALHO MÉDICO;SP;68765195.69;22921731.90;12043256.21;3
SANTA CASA DE MISERICÓRDIA DE VOTUPORANGA;SP;68030914.97;22676971.66;11702779.60;3
ASSOCIAÇÃO FUNDO DE PROTEÇÃO À SAÚDE;PR;67886179.34;22628726.45;11763233.52;3
UNIMED DE LORENA COOPERATIVA DE TRABALHO MÉDICO;SP;67883564.59;22627854.86;11145890.75;3
UNIMED DE PINDAMONHANGABA - COOPERATIVA TRABALHO MEDICO;SP;67079098.93;22359699.64;10879616.71;3
UNIMED DE ANDRADINA - COOPERATIVA DE TRABALHO MÉDICO;SP;67037113.38;22345704.46;12463197.20;3
UNIMED DE MOCOCA COOPERATIVA DE TRAB. MÉDICO;SP;65661406.08;21887135.36;12173892.74;3
UNIMED CATAGUASES COOPERATIVA DE TRABALHO MÉDICO LTDA;MG;65508638.86;21836212.95;11369776.39;3
CONFERÊNCIA SÃO JOSÉ DO AVAÍ;RJ;65490117.95;21830039.32;13337735.54;3
UNIMED VIÇOSA - COOPERATIVA DE TRABALHO MÉDICO;MG;65271092.82;21757030.94;11462642.46;3
COOPERATIVA DE TRABALHO MEDICO REGIÃO DO PLANALTO SERRANO;SC;65083926.66;21694642.22;12691929.00;3
PLANO ODONTOLÓGICO DENTALVIDAS LTDA.;SP;64954669.52;21651556.51;12121348.38;3
ASSOCIAÇÃO DOS FUNCIONÁRIOS DO FISCO DO ESTADO DE GOIÁS;GO;64518427.29;21506142.43;11746717.97;3
UNIMED DE PIRASSUNUNGA COOPERATIVA DE TRABALHO MÉDICO;SP;64382051.11;21460683.70;12394365.51;3
ASSOCIAÇÃO PARANAENSE DE ASSISTÊNCIA À SAUDE DOS MEMBROS DO MINISTERIO PUBLICO DO PARANÁ;PR;63351035.05;21117011.68;10442902.19;3
INTERMEDICI PIRACICABA ASSISTENCIA MEDICA LTDA;SP;63321496.95;21107165.65;11944468.99;3
CAIXA DE ASSISTÊNCIA DOS MAGISTRADOS DE PERNAMBUCO;PE;62544097.84;20848032.61;11430945.83;3
UNIMED DE MINEIROS COOPERATIVA DE TRABALHO MÉDICO;GO;60811192.78;20270397.59;10900657.03;3
OPERADORA DE PLANOS PRIVADOS DE SAÚDE - SANTA CASA SAÚDE LTDA;MS;60721988.30;20240662.77;10056974.16;3
UNIODONTO DE SÃO JOSÉ DOS CAMPOS COOPERATIVA DE TRABALHO ODONTOLÓGICO;SP;60187609.06;20062536.35;10874332.14;3
UNIMED DE UBA COOPERATIVA DE TRABALHO MEDICO;MG;59687239.53;19895746.51;11196583.16;3
UNIMED PONTAL DO TRIÂNGULO - COOPERATIVA DE TRABALHO MÉDICO;MG;58579771.86;19526590.62;9502802.11;3
UNIMED TRÊS CORAÇÕES COOPERATIVA DE TRABALHO MÉDICO LTDA.;MG;58282627.51;19427542.50;10799553.84;3
FUNDAÇÃO FILANTRÓPICA E BENEFICENTE DE SAÚDE ARNALDO GAVAZZA FILHO;MG;57362803.98;19120934.66;10257168.42;3
AMEP FREGUESIA OPERADORA DE PLANO DE SAUDE LTDA;RJ;56985059.21;18995019.74;9371770.93;3
UNIMED REGIONAL DE TRES LAGOAS COOPERATIVA DE TRABALHO MÉDICO;MS;56269306.56;18756435.52;10402426.98;3
UNIMED VILHENA - COOPERATIVA DE TRABALHO MEDICO LTDA;RO;56190801.65;18730267.22;13356742.91;3
UNIMED VALE DO PIQUIRI-COOPERATIVA DE TRABALHO MÉDICO VALE DO PIQUIRI;PR;55649898.73;18549966.24;9833227.53;3
UNIMED NORTE DO PARANÁ COOPERATIVA REGIONAL DE TRABALHO MÉDICO;PR;55302956.44;18434318.81;9501286.76;3
UNIMED CARATINGA - COOPERATIVA DE TRABALHO MÉDICO LTDA;MG;55299156.10;18433052.03;9288688.96;3
BRASILDENTAL OPERADORA DE PLANOS ODONTOLÓGICOS S.A.;SP;54699117.74;18233039.25;10121346.49;3
UNIMED VERTENTE DO CAPARAÓ - COOPERATIVA DE TRABALHO MÉDICO LTDA;MG;54598843.93;18199614.64;9556849.01;3
UNIMED NOROESTE DE MINAS COOPERATIVA DE TRABALHO MEDICO LTDA;MG;54380598.07;18126866.02;10333339.53;3
POLI SAUDE OPERADORA DE PLANO DE SAUDE LTDA;PR;53016062.97;17672020.99;9642301.22;3
UNIMED GURUPI COOPERATIVA DE TRABALHO MÉDICO;TO;52843323.22;17614441.07;8914130.20;3
AMPARA ASSISTÊNCIA MÉDICA PARAÍSO LTDA;MG;52789470.56;17596490.19;8999571.70;3
PREVIDENT ASSISTÊNCIA ODONTOLÓGICA S.A;SP;52188398.03;17396132.68;8742385.81;3
UNIMED PLANALTO CENTRAL/RS - COOPERATIVA DE ASSISTÊNCIA  À SAÚDE LTDA.;RS;52123502.82;17374500.94;10094170.28;3
SUL AMÉRICA PARANÁ CLÍNICAS SERVIÇOS DE SAÚDE S.A.;SP;51633802.49;17211267.50;14087501.24;3
UNIMED FRUTAL COOPERATIVA DE TRABALHO MEDICO LTDA;MG;51489885.48;17163295.16;8296746.96;3
UNIMED DE SAO JOSÉ DO RIO PARDO-COOP. DE TRAB. MÉDICO;SP;51389873.77;17129957.92;9307512.54;3
FUNDAÇÃO DE ASSISTÊNCIA À SAÚDE DA ASSOCIAÇÃO DO MINISTÉRIO PÚBLICO DO RIO GRANDE DO SUL;RS;51365823.02;17121941.01;10212938.32;3
UNIMED REGIÃO DA CAMPANHA/RS - COOPERATIVA DE ASSISTÊNCIA À SAÚDE LTDA.;RS;51257150.61;17085716.87;9071994.89;3
SF SISTEMAS DE SAÚDE LTDA;SP;51102054.63;17034018.21;10397248.98;3
UNIMED LEOPOLDINA COOPERATIVA DE TRABALHO MÉDICO LTDA;MG;49409109.46;16469703.15;10239124.04;3
UNIMED DE ADAMANTINA-COOPERATIVA DE TRABALHO MÉDICO;SP;48149790.11;16049930.04;8463321.36;3
ASSOCIAÇÃO PLANO DE SAÚDE SANTA CASA DE VALINHOS;SP;48139345.76;16046448.59;8475764.99;3
UNIMED ALFENAS COOPERATIVA DE TRABALHO MEDICO;MG;48031649.71;16010549.90;8603002.52;3
TERRAMAR ADMINISTRADORA DE PLANO DE SAUDE LTDA;BA;47359676.28;15786558.76;9422364.73;3
SBC SAÚDE LTDA.;SP;47048836.47;15682945.49;7652003.83;3
SOCIEDADE BENEFICENTE DEZOITO DE JULHO;MG;46916416.98;15638805.66;8296513.00;3
UNIMED DE DRACENA - COOPERATIVA DE TRABALHO MÉDICO;SP;46603988.88;15534662.96;8128893.98;3
ASSOCIAÇÃO POLICIAL DE ASSISTÊNCIA À SAÚDE DE RIBEIRÃO PRETO (APAS);SP;46304852.06;15434950.69;7909288.49;3
PLAMER PLANO MEDICO RESENDE LTDA;RJ;46111884.69;15370628.23;6974725.84;3
UNIMED DE MONTE ALTO - COOPERATIVA DE TRABALHO MÉDICO;SP;45601533.47;15200511.16;7919299.06;3
FILOSANITAS SAUDE LTDA;SP;45263251.89;15087750.63;8439352.67;3
IRMANDADE DA SANTA CASA DE MISERICÓRDIA E MATERNIDADE DONA ZILDA SALVAGNI;SP;45158573.09;15052857.70;7862936.63;3
UNIMED-RIO COOPERATIVA DE TRABALHO MEDICO DO RIO DE JANEIRO;RJ;43905275.41;43905275.41;0;1
UNIMED CALDAS NOVAS - COOPERATIVA DE TRABALHO MEDICO;GO;43778931.74;14592977.25;7477865.04;3
UNIMED DE REGISTRO COOPERATIVA DE TRABALHO MÉDICO;SP;43716496.47;14572165.49;7319021.15;3
ASSOCIACAO DOS PROFESSORES UNIVERSITÁRIOS DA BAHIA;BA;42990324.37;14330108.12;7625127.26;3
UNIMED SÃO SEBASTIÃO DO PARAÍSO COOPERATIVA DE TRABALHO MÉDICO;MG;42744025.09;14248008.36;7420338.05;3
UNIMED TRÊS PONTAS - COOPERATIVA DE TRABALHO MÉDICO;MG;42632263.76;14210754.59;7433165.12;3
ADVANCE PLANOS DE SAÚDE LTDA;SP;42487948.39;14162649.46;7782476.37;3
ASSOCIAÇÃO DOS AUDITORES FISCAIS DA RECEITA ESTADUAL DO RIO DE JANEIRO;RJ;41941274.83;13980424.94;6179147.98;3
UNIODONTO BELÉM - COOPERATIVA DE ASSISTÊNCIA À SAÚDE ODONTOLÓGICA;PA;41902718.06;13967572.69;7360738.61;3
UNIMED REGIONAL DE FLORIANO - COOPERATIVA DE TRABALHO MÉDICO;PI;41808771.09;13936257.03;7128594.47;3
UNIMED VALE DO CORUMBÁ COOPERATIVA DE TRABALHO MEDICO;GO;41151778.84;13717259.61;7504109.18;3
ASSOCIAÇÃO DOS EMPREGADOS DA COMPANHIA ESTADUAL DE HABITAÇÃO E OBRAS PÚBLICAS - ASSEC;SE;40993810.66;13664603.55;7551041.80;3
TRINO - ALIANCA FILANTRÓPICA DE ASSISTÊNCIA E INTEGRAÇÃO PARA O DESENVOLVIMENTO DA SAUDE;ES;40930520.81;13643506.94;7963755.52;3
UNIMED SUDOESTE DE MINAS COOPERATIVA DE TRABALHO MÉDICO;MG;40828472.23;13609490.74;8314137.01;3
PRONTOCLINICA E HOSPITAIS SAO LUCAS S/A;MG;40760453.54;13586817.85;7406365.04;3
UNIMED REGIÃO DA FRONTEIRA - RS COOPERATIVA DE ASSISTÊNCIA À SAÚDE LTDA.;RS;40124974.00;13374991.33;7089448.08;3
ASSOCIAÇÃO SANTA CASA CLÍNICAS DE BIRIGUI;SP;40106341.70;13368780.57;7084172.82;3
SV SAUDE ADMINSTRADORES DE PLANO DE SAUDE LTDA;RJ;40014465.24;13338155.08;7326531.74;3
FEDERAÇÃO DAS COOP ODONTOLÓGICAS DO ESTADO DE SANTA CATARINA;SC;39286550.81;13095516.94;7403081.14;3
ASSOCIAÇÃO POLICIAL DE ASSISTÊNCIA A SAÚDE DA BAIXADA SANTISTA;SP;39032171.94;13010723.98;6312731.80;3
FUNDACAO CAPITAL PREVIDENCIA E SAUDE - CAPITAL PREV;ES;39028302.27;19514151.14;8457314.95;2
UNIX SAÚDE S.A;BA;38097944.74;12699314.91;6616134.87;3
PB ASSISTENCIA MEDICA EU LTDA;BA;37662784.06;12554261.35;8181540.35;3
ASSOCIAÇÃO POLICIAL DE ASSISTÊNCIA À SAÚDE DE ARAÇATUBA (APAS);SP;37268939.14;12422979.71;6097749.59;3
UNIMED SUDOESTE PAULISTA COOPERATIVA DE TRABALHO MÉDICO;SP;37183333.57;12394444.52;6469154.22;3
SANTA CASA DE MISERICORDIA HOSPITAL SÃO VICENTE;SP;37006761.88;12335587.29;6554588.82;3
FEDERAÇÃO DAS SOCIEDADES COOPERATIVAS DE TRABALHO MÉDICO DO ACRE, AMAPÁ, AMAZONAS, PARÁ, RONDONIA E RORAIMA;AM;36918032.69;36918032.69;0;1
CAIXA DE ASSISTÊNCIA DOS EMPREGADOS DO BANESE;SE;36127689.51;12042563.17;6061754.89;3
ATÍVIA SERVIÇOS DE SAÚDE S/A;SP;35493111.49;17746555.75;3835730.16;2
PESSOAL SAÚDE PLANOS DE ASSISTÊNCIA MÉDICA LTDA;SP;35484113.44;11828037.81;6202246.92;3
EVANGELICO SAUDE LTDA.;PR;34761835.18;11587278.39;5740043.33;3
COOPERATIVA DOS USUÁRIOS DE SERVIÇOS DE SAÚDE LTDA.;RS;33819143.19;11273047.73;6366348.59;3
UNIODONTO DE FORTALEZA COOPERATIVA DE TRABALHO ODONTOLOGICO LTDA;CE;33533939.41;11177979.80;5837008.48;3
ASSOCIAÇÃO GOIANA DO MINISTÉRIO PÚBLICO;GO;33283866.85;11094622.28;5913645.58;3
ALLIANZ SAÚDE S/A;SP;32422966.53;10807655.51;3919311.71;3
ASSOCIAÇÃO SAÚDE CONCEIÇÃO;SC;32135174.40;10711724.80;6095944.71;3
CAIXA DE ASSISTÊNCIA DOS EMPREGADOS DO BANEB;BA;31883484.09;10627828.03;3962559.68;3
UNIMED CACERES COOPERATIVA DE TRABALHO MÉDICO;MT;31759388.42;10586462.81;5265321.99;3
AME VVIDA PLANOS DE SAUDE INTEGRADO LTDA.;RO;31438475.12;10479491.71;5339997.81;3
CAIXA DE ASSISTÊNCIA DO SINDFISCO - CASSIND;SE;31332223.65;10444074.55;5774695.03;3
SANTA CASA DE MISERICÓRDIA E BENEFICÊNCIA PORTUGUESA;SP;31168285.71;10389428.57;6198979.77;3
UNIODONTO REGIONAL COOPERATIVA ODONTOLOGICA;MG;30926940.40;10308980.13;5671047.72;3
MAIS SAUDE S/A;ES;30067203.76;15033601.88;10669027.51;2
UNIODONTO MACEIÓ COOPERATIVA ODONTOLÓGICA;AL;29740993.05;9913664.35;5215338.09;3
BIO SAÚDE SERVIÇOS MÉDICOS LTDA;SP;29568902.55;9856300.85;4774651.78;3
SOCIEDADE PORTUGUESA DE BENEFICÊNCIA;RS;29499003.49;9833001.16;5241147.29;3
UNIODONTO PORTO ALEGRE COOPERATIVA ODONTOLOGICA LTDA;RS;29446934.63;9815644.88;6163350.43;3
UNIDENTIS ASSISTENCIA ODONTOLOGICA LTDA.;PB;29342091.79;9780697.26;4909307.13;3
DESBAN - FUNDAÇÃO BDMG DE SEGURIDADE SOCIAL;MG;29183836.20;9727945.40;4855191.17;3
UNIODONTO PIRACICABA - COOPERATIVA ODONTOLÓGICA;SP;29082633.43;9694211.14;5400955.88;3
UNIODONTO/RN - COOPERATIVA ODONTOLOGICA DO RIO GRANDE DO NORTE;RN;28897419.15;9632473.05;5138323.51;3
ASSOCIAÇÃO VALEPARAIBANA DE ASSISTÊNCIA MÉDICA POLICIAL;SP;28302930.25;9434310.08;3489899.04;3
UNIMED REGIÃO DA PRODUÇÃO/RS - COOPERATIVA DE ASSISTÊNCIA À SAÚDE LTDA;RS;27781169.98;9260389.99;5402023.56;3
UNIODONTO DE SC COOPERATIVA ADMINISTRADORA DE CONTRATOS;SC;27726742.44;9242247.48;4940024.21;3
SANTA CASA DE SAÚDE - SCS;ES;27560748.39;9186916.13;5354626.88;3
UNIODONTO GOIANIA COOPERATIVA DE CIRURGIÕES DENTISTAS;GO;27439145.21;9146381.74;4931835.02;3
UNIMED SÃO JOÃO NEPOMUCENO COOPERATIVA DE TRABALHO MÉDICO LTDA.;MG;27393937.08;9131312.36;4833721.27;3
ATITUDE SAÚDE ASSISTÊNCIA MEDICA LTDA;BA;26971823.53;8990607.84;5239004.29;3
UNIMED DE PENAPOLIS - COOPERATIVA DE TRABALHO MEDICO;SP;26228831.63;8742943.88;5275400.64;3
UNIMED DE JATAÍ COOPERATIVA DE TRABALHO MÉDICO LTDA.;GO;25965374.28;8655124.76;4943828.60;3
HOSPITAL DE PRONTOCLINICA LTDA.;RS;25551239.89;8517079.96;4213378.71;3
UNIMED MACHADO COOPERATIVA DE TRABALHO MEDICO;MG;25264551.20;8421517.07;4580668.70;3
UNIMED VALE DO CARANGOLA COOPERATIVA DE TRABALHO MEDICO LTDA;MG;25171301.45;8390433.82;4500609.25;3
FUNASA SAÚDE;PB;24996006.83;8332002.28;4475865.02;3
NACIONAL ODONTO OPERADORA DE PLANOS ODONTOLÓGICOS LTDA.;PE;24628998.22;8209666.07;4055610.56;3
AURORA SAÚDE LTDA;MG;24535483.91;8178494.64;5053360.75;3
UNIMED ALTO JACUÍ/RS - COOPERATIVA DE ASSISTÊNCIA À SAÚDE LTDA;RS;24110155.79;8036718.60;3857214.42;3
UNIMED PATOS - COOPERATIVA DE TRABALHO MÉDICO;PB;23857790.32;7952596.77;4422373.22;3
COOPERATIVA DOS USUÁRIOS DE SERVIÇOS DE SAÚDE DO VALE DO RIO DOS SINOS LTDA;RS;23785655.50;7928551.83;3931335.89;3
CARE PLUS ODONTOLOGIA ASSISTENCIAL LTDA.;SP;22863385.15;7621128.38;6765873.97;3
RIO DOCE SAÚDE;ES;22861517.03;7620505.68;4218229.47;3
VIDA TOP MAIS SAÚDE OPERADORA DE PLANOS DE SAÚDE LTDA.;SP;22760529.86;7586843.29;4638718.15;3
ON MED ASSISTÊNCIA MÉDICA LTDA;RS;22319128.34;7439709.45;5463249.41;3
R.M.I. OPERADORA DE SAÚDE INTEGRADA LTDA;SP;22021317.66;11010658.83;3401098.47;2
ASSOCIACAO POLICIAL DE ASSISTENCIA A SAUDE DE PRESIDENTE PRUDENTE (APAS);SP;21893988.12;7297996.04;4043911.76;3
UNIMED PONTE NOVA COOPERATIVA DE TRABALHO MEDICO LTDA;MG;21838755.97;7279585.32;4143177.09;3
UNIODONTO DE JOÃO PESSOA COOPERATIVA ODONTOLÓGICA;PB;21819023.21;7273007.74;3254904.29;3
VIVENTERIS LTDA;PR;21037418.58;7012472.86;3773076.54;3
UNIMED REGIONAL DE PICOS - COOPERATIVA DE TRABALHO MÉDICO;PI;21012800.12;7004266.71;3605941.46;3
ASSOCIAÇAO UNISAUDE MARAU;RS;20922243.10;6974081.03;3432876.69;3
SUL DO PARÁ LTDA;PA;20830054.23;6943351.41;2386761.76;3
TOTAL ASSISTÊNCIA MÉDICA HOSPITALAR LTDA;MG;20400383.15;6800127.72;3511603.89;3
ASSOCIAÇÃO POLICIAL DE ASSISTÊNCIA A SAÚDE;SP;20348295.20;6782765.07;3599016.24;3
UNIMED DE CORUMBA COOPERATIVA DE TRABALHO MÉDICO;MS;20296630.68;6765543.56;3947456.74;3
ODONTO EMPRESAS CONVENIOS DENTARIOS LTDA.;SP;19846633.42;6615544.47;3514459.94;3
UNIMED MORRINHOS COOPERATIVA DE TRABALHO MEDICO;GO;19563734.70;6521244.90;3950200.01;3
UNIODONTO DO BRASIL CENTRAL NACIONAL DAS COOPERATIVAS ODONTÓLOGICAS;SP;19530587.94;6510195.98;3783886.55;3
ASSOCIACAO DE SAUDE HOLAMBRA;SP;19166372.99;6388791.00;3582982.16;3
ODONTOGROUP SISTEMA DE SAÚDE LTDA.;DF;19093145.77;6364381.92;3372181.72;3
UNIMED DO OESTE DA BAHIA COOPERATIVA DE TRABALHO MÉDICO;BA;18915952.32;6305317.44;4074774.99;3
ASSOCIAÇÃO DOS SERVIDORES MUNICIPAIS, ESTADUAIS E FEDERAIS DO RIO DE JANEIRO;RJ;18901491.49;6300497.16;3284553.56;3
UNIMED SOUSA - COOPERATIVA DE TRABALHO MÉDICO;PB;18726821.42;6242273.81;2814449.16;3
FUNDAÇÃO PLAMHUV - PLANO MÉDICO HOSPITALAR DOS HOSPITAIS UNIDOS DE VIÇOSA;MG;18323555.31;6107851.77;3494458.90;3
HOSPITAL CESAR LEITE;MG;18019610.22;6006536.74;3500486.39;3
UNIODONTO PAULISTA-FEDERAÇÃO DAS COOPERATIVAS ODONTOLÓGICAS DO ESTADO DE SÃO PAULO;SP;17936406.37;5978802.12;3269223.54;3
ASSOCIAÇÃO DOS FUNCIONÁRIOS FISCAIS DO ESTADO DO AMAZONAS - AFFEAM;AM;17191045.51;5730348.50;3753418.83;3
OPLAN SAÚDE OPERADORA DE PLANO DE SAÚDE LTDA;RJ;17129746.25;5709915.42;3180779.93;3
UNIODONTO DE MANAUS - COOPERATIVA ODONTOLÓGICA LTDA.;AM;16658539.89;5552846.63;2733592.16;3
SOCIEDADE DE ASSISTÊNCIA MÉDICA - SAMEISA;RS;16609677.09;5536559.03;2888163.00;3
CAIXA DE ASSISTÊNCIA À SAÚDE DOS TRABALHADORES NAS INDÚSTRIAS METALÚRGICAS, MECÂNICAS E DO MATERIAL ELÉTRICO DE BRUSQUE;SC;16556440.91;5518813.64;3022697.48;3
ASSOCIAÇÃO BENEFICENTE CATÓLICA;MG;16120312.08;5373437.36;2798238.00;3
SISTEMA TOTAL DE SAÚDE LTDA.;SP;15911906.56;5303968.85;2653520.84;3
CAIXA ASSISTENCIAL UNIVERSITARIA DO RIO DE JANEIRO;RJ;15777890.59;5259296.86;2748659.14;3
ANGELI SISTEMAS DE SAUDE S.A.;PR;15414761.42;5138253.81;2739833.02;3
HOSPITAL S.P. LTDA.;RS;15246610.37;5082203.46;2413900.65;3
ASSOCIAÇÃO POLICIAL DE ASSISTENCIA À SAUDE DE SAO JOAO DA BOA VISTA;SP;15186245.77;5062081.92;2788408.93;3
